,is_sarcastic,titles,article_link
0,0,Coloradans Are Getting Mysterious Texts Bashing Democratic Senate Candidate John Hickenlooper,https://www.huffpost.com/entry/hickenlooper-colorado-senate-mystery-texts_n_5eecfe1ec5b6de061bd1458e
1,0,I've Decided To Come Out To The World As Genderfluid After Nearly Dying From COVID-19,https://www.huffpost.com/entry/genderfluid-coming-out-coronavirus_n_5ee256f1c5b68d459bca885a
2,0,IBM To End Facial Recognition Business And Oppose Use For Surveillance By Police,https://www.huffpost.com/entry/ibm-facial-recognition_n_5edeefc4c5b6fdc1523d16ba
3,0,Sophie Turner Schools Commenter Questioning Black Lives Matter Protests,https://www.huffpost.com/entry/sophie-turner-schools-commenter-questioning-black-lives-matter-protests_n_5ede29ecc5b6ded86fb81a6e
4,0,Bronx Rep. Eliot Engel’s Hot Mic Moment Gives Progressive Opponent An Opening,https://www.huffpost.com/entry/eliot-engel-hot-mic-comments-jamaal-bowman-democratic-primary-bronx_n_5ed70746c5b6aade1be3af27
5,0,Colbert Nails Why Trump Likes Military Bases Named For 'Old Racist Guys',https://www.huffpost.com/entry/stephen-colbert-donald-trump-military-bases-racist_n_5ee34ae2c5b63db52533db04
6,0,Facebook To Label State-Controlled Media Organizations,https://www.huffpost.com/entry/facebook-state-controlled-media-label_n_5ed92a7ac5b6a832ca8bda5e
7,0,Christopher Columbus Statue Beheaded In Boston Park,https://www.huffpost.com/entry/christopher-columbus-boston-statue-beheading_n_5ee0f143c5b6cdc3fd4370ee
8,0,Ferguson Just Elected Its First Black Mayor,https://www.huffpost.com/entry/ferguson-missouri-first-black-mayor_n_5ed704bfc5b67913aa26af25
9,0,"North Korea Attacks Inter-Korean Liaison Office, South Korea Says",https://www.huffpost.com/entry/north-korea-south-korea-dmz_n_5ee86976c5b6da4ae60d594a
10,0,Barack And Michelle Obama Advise Graduates How To Utilize Turmoil,https://www.huffpost.com/entry/barack-michelle-obama-high-school-graduates-2020_n_5ede4c94c5b64a0a73d85274
11,0,Matt James Named First Black Lead Of 'The Bachelor',https://www.huffpost.com/entry/the-bachelor-matt-james-first-black-lead_n_5ee379dcc5b6f2cb034fbed3
12,0,Investing In Harm Reduction Must Be Included In The Movement To Defund Police,https://www.huffpost.com/entry/defund-police-harm-reduction_n_5ee12433c5b6d2832d22adc2
13,0,"Keith Ellison, Once An Activist, Meets His Moment As Minnesota’s Top Prosecutor",https://www.huffpost.com/entry/minnesota-attorney-general-keith-ellison-meets-his-moment-george-floyd-minneapolis_n_5ee2a2bbc5b67266c4d5d4bc
14,0,Tom Cotton Says Trump Should Deploy U.S. Military To Contain Protests,https://www.huffpost.com/entry/george-floyd-military-cotton_n_5ed511f3c5b677940f138a81
15,0,Joe Biden Raised More Money Than Donald Trump For The First Time,https://www.huffpost.com/entry/joe-biden-raised-more-money-than-donald-trump-for-the-first-time_n_5eee1ffec5b6a10e6b6e89a0
16,0,George Floyd's Son Visits Site Where Father Was Killed: 'We Want Justice',https://www.huffpost.com/entry/george-floyd-family-cup-foods_n_5ed7d094c5b61449018d8cca
17,0,I'm At Home With A Profoundly Disabled Child And I'm Afraid I Can't Meet His Needs,https://www.huffpost.com/entry/homeschooling-disabled-children-coronavirus_n_5e87c846c5b6cc1e477556f5
18,0,Book By Trump’s Niece To Reveal He ‘Derided’ Father’s Alzheimer’s Struggles,https://www.huffpost.com/entry/mary-donald-fred-trump-alzheimers_n_5ee99d27c5b6f54b3eac4a17
19,0,NYPD To Reassign 600 ‘Anti-Crime’ Plainclothes Officers Amid Protests,https://www.huffpost.com/entry/nypd-anti-crime-officers-reassigned-reform_n_5ee807fec5b6dad91fdf4f16
20,0,Lea Michele Apologizes After 'Glee' Co-Star Blasts Her On-Set Behavior,https://www.huffpost.com/entry/lea-michele-glee-behavior-apology_n_5ed795fbc5b6b7b4b6c3f581
21,0,HBO Max Pulls 'Gone With The Wind' For 'Racist Depictions',https://www.huffpost.com/entry/hbo-max-gone-with-the-wind_n_5ee0b363c5b6faafc92bae99
22,0,Coronavirus Live Updates: Read The Latest About The COVID-19 Outbreak,https://www.huffpost.com/entry/covid-19-latest-news-around-world_n_5eea17ccc5b69322bc19a3b7
23,0,Trump Defends Church Photo Op: ‘I Think It Was Very Symbolic’,https://www.huffpost.com/entry/trump-defends-bible-church-photo-op_n_5ed7cbfbc5b6a4143c45dbcb
24,0,Zoomers Boast They Sabotaged Trump Rally Turnout With Fake Reservations,https://www.huffpost.com/entry/tik-tok-kpop-zoomer-trump-rally-tulsa_n_5eeee1e2c5b65038ef03a9f5
25,0,Justice Department Sets New Dates To Begin Executing Federal Inmates On Death Row,https://www.huffpost.com/entry/new-dates-executing-federal-inmates-on-death-row_n_5ee885dac5b603bea73bbb2f
26,0,"Conservative Icon George Will Urges Nov. Sweep: Vote Out Trump, All GOP Enablers",https://www.huffpost.com/entry/george-will-trump-republicans_n_5ed5bb7ac5b6e87a67b8f7ae
27,0,Trump Cheers Tom Cotton After Times Editor’s Exit Over Op-Ed,https://www.huffpost.com/entry/donald-trump-tom-cotton-new-york-times-op-ed_n_5edd634ec5b68bf3a056f920
28,0,Millions Are Unemployed. Crises Abound. Is It Time To Guarantee Public Service Jobs?,https://www.huffpost.com/entry/job-guarantee-economic-recovery_n_5eed5b25c5b6852c20f3dd30
29,0,"Supreme Court Rules Trump Wrongly Ended DACA, Leaves Program In Place",https://www.huffpost.com/entry/supreme-court-leaves-daca-in-place-dreamers_n_5ea1ad75c5b6f5350a34cec5
30,0,Rev. Al Sharpton Slams Trump: 'We Cannot Use Bibles As A Prop',https://www.huffpost.com/entry/al-sharpton-trump-bible-photo-op_n_5ed975c8c5b645f058609cdc
31,0,Women Are Sharing Candid Photos To Send A Message To Pandemic Body-Shamers,https://www.huffpost.com/entry/body-positive-instagram-project-coronavirus_n_5ecd64dcc5b66bb55e1e1043
32,0,"After Giving Birth, I Had Violent Thoughts About Hurting My Baby. Now I Know Why.",https://www.huffpost.com/entry/what-its-like-postpartum-ocd_n_5ec54bb0c5b6729758746bb9
33,0,Chris D'Elia Responds To Claims He Sexually Harassed Underage Girls,https://www.huffpost.com/entry/chris-delia-comedian-sexual-harassment_n_5eea7ad5c5b67a171c2cfc04
34,0,"TikTok Users, K-Pop Fans Say They Sabotaged Trump Rally By Inflating Registrations",https://www.huffpost.com/entry/tiktok-kpop-trump-rally_n_5eeff5ffc5b6f56acbc03451
35,0,China's New Virus Outbreak Underscores Continued Threat,https://www.huffpost.com/entry/china-new-virus-outbreak_n_5ee73f99c5b662f5854f84d4
36,0,Lone Protester Left Bleeding After Buffalo Cops Push Him To The Ground,https://www.huffpost.com/entry/buffalo-police-push-protester_n_5ed9a282c5b604793f765974
37,0,My Nephew Got Out Of Prison Due To COVID-19. But Where Is He Supposed To Go?,https://www.huffpost.com/entry/prison-release-covid-19_n_5e879b3bc5b6e7d76c6393f3
38,0,"Trump Says He Gave Out 1 Million Tickets To His Tulsa Rally. That Means 980,801 Fans Won't Fit.",https://www.huffpost.com/entry/trump-tulsa-oversold_n_5ee8e5fcc5b6f9929a8c35a5
39,0,"Trump Calls Governors ‘Weak,’ Urges Tougher Crackdown On Protests",https://www.huffpost.com/entry/donald-trump-protests-governors-weak-police-brutality_n_5ed51fd3c5b63bc4db6be36d
40,0,"List For Biden’s VP Pick Narrows Down To Warren, Harris, Susan Rice And More",https://www.huffpost.com/entry/biden-vice-president-harris-warren_n_5ee3e19ac5b684a0c4f2e5d8
41,0,"Guardsman Told Barr Protest Was Peaceful Before Violent Attack, Lawmaker Says",https://www.huffpost.com/entry/bill-barr-national-guard-peaceful-protesters-eleanor-holmes-norton_n_5edec67dc5b601aa32429385
42,0,Here's What It's Like To Suffer From Debilitating Germophobia During The COVID-19 Crisis,https://www.huffpost.com/entry/germaphobia-coronavirus-prevention-pandemic_n_5e8f3f7cc5b6458ae2a56eff
43,0,Minneapolis Police Dept. Withdrawing From Union Negotiations,https://www.huffpost.com/entry/minneapolis-police-union-negotiations_n_5ee0fc8bc5b6493f7dc27484
44,0,Jimmy Kimmel Mocks 'Weak' Trump: 'There's Clearly Something Going On',https://www.huffpost.com/entry/jimmy-kimmel-trump-water-ramp-walk_n_5ee86315c5b693c5d0de7829
45,0,Trump Is Back To Business As Usual As Virus Surges In States,https://www.huffpost.com/entry/trump-gets-back-to-business-as-usual-as-outbreak-spikes-in-states_n_5ee37a35c5b6f2cb034fbfaf
46,0,'This Is Us' Writer Jas Waters Dies At 39,https://www.huffpost.com/entry/jas-waters-this-is-us-dies_n_5ee1f5d8c5b67cba495cba92
47,0,Former Atlanta Cop Charged With Murder In Death Of Rayshard Brooks,https://www.huffpost.com/entry/former-atlanta-cop-charged-murder-rayshard-brooks_n_5eea3d33c5b638d5a1190e94
48,0,CrossFit CEO Steps Down After Stunningly Racist Commentary,https://www.huffpost.com/entry/crossfit-ceo-greg-glassman-steps-down-retires_n_5ee0ee3dc5b64cc5d0223968
49,0,New York Times Opinion Chief James Bennet Out After 'Send In The Troops' Op-Ed,https://www.huffpost.com/entry/james-bennet-new-york-times-opinion-page-resigned_n_5edd4bd2c5b62c33fca387a2
50,0,The Supreme Court’s Landmark LGBTQ Rights Decision Didn't Address One Crucial Thing,https://www.huffpost.com/entry/religious-liberty-lgbtq-rights-supreme-court_n_5ee7ae6ac5b69e598c702154
51,0,Michael Che Likens His Black Lives Matter Bit To 'Amazing Grace',https://www.huffpost.com/entry/michael-che-black-lives-matter-seth-meyers_n_5ed77ce3c5b6fafa9260df8e
52,0,My Teen Daughter Is Sick But Can't Get The Coronavirus Test. That's Simply Not OK.,https://www.huffpost.com/entry/coronavirus-test-parenting_n_5e6e4694c5b6bd8156f95667
53,0,Trump's Midnight Twitter Rant Against Bolton Backfires Spectacularly,https://www.huffpost.com/entry/donald-trump-john-bolton-best-people_n_5eeb0aadc5b6eab8ed9c52fd
54,0,Houston To Hold 6-Hour Public Viewing Of George Floyd's Casket,https://www.huffpost.com/entry/houston-to-hold-6-hour-public-viewing-of-george-floyds-casket_n_5ede2012c5b615b2c11aeff5
55,0,Pence Says Oklahoma COVID-19 Cases Have 'Flattened' — 2 Days After Record Jump,https://www.huffpost.com/entry/mike-pence-oklahoma-covid-19-flat-record_n_5ee7ed42c5b683f46151505c
56,0,"NYC Mayor Bill De Blasio Enforces Curfew Again, Setting Up Another Night Of Police Assaults",https://www.huffpost.com/entry/nypd-violent-crackdown-protesters-de-blasio-curfew_n_5ed9a813c5b612ac98d2e5b7
57,0,NFL QB: Drew Brees: 'I Will Never Agree With Anybody Disrespecting The Flag',https://www.huffpost.com/entry/drew-brees-flag-kneeling-disrespectful_n_5ed7e18fc5b68462d39e7fee
58,0,Police Arrest Cyclist In Assault Of Girl Posting George Floyd Protest Signs,https://www.huffpost.com/entry/cyclist-girl-george-floyd-maryland_n_5eda1e6dc5b6debb3669babf
59,0,Joe Biden Has Already Considered What To Do If Trump Refuses To Leave Office,https://www.huffpost.com/entry/joe-biden-remove-trump-from-the-white-house_n_5ee21f1ec5b6843ba6f808cf
60,0,Cate Blanchett Suffers ‘Little Nick To The Head’ In Chainsaw Accident,https://www.huffpost.com/entry/cate-blanchett-chainsaw-accident_n_5edb6d01c5b6b501386056ff
61,0,Tulsa Health Official Has A Stark Wake-Up Call For People Attending Trump Rally,https://www.huffpost.com/entry/donald-trump-rally-tulsa-officials-safety_n_5eedd381c5b675e23bafee5f
62,0,Minnesota Files Civil Rights Charge Against Police In George Floyd's Death,https://www.huffpost.com/entry/minnesota-files-complaint-police-george-floyd_n_5ed6a4dbc5b61c46ffb30153
63,0,Former Joint Chiefs Chairman Sounds Off On Trump: 'I Cannot Remain Silent’,https://www.huffpost.com/entry/mike-mullen-trump-military_n_5ed7292ec5b67913aa26bf10
64,0,Trump Administration Sues To Block Release Of Bolton Book,https://www.huffpost.com/entry/trump-administration-sue-john-bolton-book_n_5ee93ba3c5b695286b787621
65,0,NYPD Finds ‘No Criminality’ After Cop Union Alleged Shake Shack Poisoned Officers,https://www.huffpost.com/entry/nypd-shake-shack-officers-poisoned-investigation_n_5ee8cfaac5b6add763186556
66,0,How Coronavirus Is Threatening Democracy,https://www.huffpost.com/entry/coronavirus-europe-election-campaigns-voting_n_5eda1570c5b6debb36699b53
67,0,'A Shocking Dereliction Of Duty': Supreme Court Brushes Off Police Immunity Cases,https://www.huffpost.com/entry/qualified-immunity-police-supreme-court_n_5ee79010c5b691bb23b4cfe7
68,0,CBS Reporter Paula Reid Asks Trump Question All Journalists Should Ask,https://www.huffpost.com/entry/paula-reid-cbs-donald-trump-liars-and-wackos_n_5eebdda6c5b6f3838508d630
69,0,Pols Tell Trump To Go Back To The Bunker After His Threat To ‘Take Back’ Seattle,https://www.huffpost.com/entry/trump-take-back-seattle_n_5ee1b8a7c5b689b30375c583
70,0,Reggie Watts Breaks Down In Heartbreaking Chat With James Corden About Racism,https://www.huffpost.com/entry/reggie-watts-racism-james-corden-late-late-show_n_5ed5fa42c5b6c2652b6a3235
71,0,"There's A Global Pandemic, And My Father Has Absolutely No Idea",https://www.huffpost.com/entry/dementia-lewy-body-coronavirus_n_5e8de423c5b61ada15c0cbc0
72,0,Trump Tries To Explain Awkward West Point Walk That Lit Up Twitter Critics,https://www.huffpost.com/entry/trump-awkward-walk-west-point_n_5ee59c00c5b6f20b4d0e8eeb
73,0,I'm Bisexual. I Used Coming Out As An April Fools' Joke — And I Want To Apologize.,https://www.huffpost.com/entry/zachary-smith-bisexual-coming-out-tik-tok-april-fools-day_n_5eb1b428c5b6931ffc985fd8
74,0,New York City Curfew Lifts Early Following Peaceful Protests,https://www.huffpost.com/entry/new-york-city-curfew-lifts-early-de-blasio_n_5edd1388c5b695e290705228
75,0,Ex-Judge Says Push To Dismiss Flynn Case Is 'Abuse Of Power',https://www.huffpost.com/entry/michael-flynn-john-gleeson_n_5ee10f53c5b6d5bafa560302
76,0,Washington Post Editorial Issues Dire Warning To Trump Aides 'Enabling His Incitement',https://www.huffpost.com/entry/washington-post-editorial-board-donald-trump-enablers_n_5ed7735fc5b6384a9d476c7b
77,0,Republicans Dismiss Bombshell John Bolton Allegations Against Trump,https://www.huffpost.com/entry/john-bolton-book-trump_n_5eebb62cc5b6674372346e47
78,0,Teacher Ousts West Virginia State Senate Leader In GOP Primary,https://www.huffpost.com/entry/west-virginia-teacher-strikes-senate-primary_n_5ee0f238c5b6147d60259085
79,0,Joe Scarborough Rips Trump With Painfully Honest Rewrite Of Rally Coronavirus Waiver,https://www.huffpost.com/entry/joe-scarborough-donald-trump-coronavirus-rally-waiver_n_5ee36daec5b6c55cf60e4c19
80,0,John Bolton Aims To Publish Tell-All White House Memoir In June: Report,https://www.huffpost.com/entry/john-bolton-tell-all-memoir-june-publication_n_5edd8618c5b6bd197e1422fe
81,0,White House Security Barred Clergy From Holding Vigil Outside Church,https://www.huffpost.com/entry/clergy-prayer-vigil-st-johns-church_n_5ed92b53c5b6fb6d6b3b254e
82,0,Donald Trump Is Acting Like The Coronavirus Is Gone. It Isn’t.,https://www.huffpost.com/entry/donald-trump-is-acting-like-the-coronavirus-is-gone-it-isnt_n_5ee12c2ec5b6d1ad2bd824c8
83,0,I'm An Angry Black Woman. This Is What I Want White People To Know.,https://www.huffpost.com/entry/angry-black-woman-wants-white-people-to-know_n_5ed0ff24c5b6392ca7780981
84,0,"Why Biden Is Trouncing Trump With Young Voters: ‘Old Is Way, Way Better Than Liar’",https://www.huffpost.com/entry/old-is-way-better-than-liar-why-joe-biden-is-in-a-stronger-position-than-hillary-clinton-with-young-voters_n_5eeab736c5b6aef1943fbd81
85,0,Houston Police Chief Rips Trump’s Violent Rhetoric: 'Keep Your Mouth Shut',https://www.huffpost.com/entry/houston-police-chief-donald-trump-protests_n_5ed74574c5b64febe6b0a173
86,0,Drew Brees Stands Against Trump: Racial Justice Protests 'Not About The American Flag',https://www.huffpost.com/entry/trump-backs-drew-brees-flag-protests-despite-apology_n_5ed02984c5b68bf40e3773b2
87,0,Trump White House Believes 'Defund The Police' Is A Political Gift,https://www.huffpost.com/entry/trump-white-house-defund-the-police_n_5ee14584c5b619db0cd1bea8
88,0,COVID-19 Has Devastated The Black Community. Here's Why And What Needs To Change.,https://www.huffpost.com/entry/coronavirus-black-american-community-devastated_n_5ed6a2c2c5b68113b7e4c1ee
89,0,Pointer Sisters Singer Bonnie Pointer Dies,https://www.huffpost.com/entry/bonnie-pointer-dead-pointer-sisters_n_5edf293fc5b603fb68d477d5
90,0,"West Point Cadets Ordered Back For Trump's Speech Test Positive For Coronavirus, Army Says",https://www.huffpost.com/entry/donald-trump-west-point-cadets-coronavirus_n_5ed63845c5b6079a2ccbf82f
91,0,"Bon Appétit Top Editor Adam Rapoport Resigns After Brownface Photo, Outcry From Staffers Of Color",https://www.huffpost.com/entry/bon-appetit-editor-in-chief-resigns_n_5ede930ec5b6ee33e1779871
92,0,‘Vanderpump Rules’ Stars Canned For Racist Treatment Of Black Co-Star,https://www.huffpost.com/entry/bravo-fires-stassi-schroeder-kristen-doute_n_5edfcca1c5b647b62cc248d8
93,0,I Started My Period At Age 10. My Mom Made It The Best Day Ever.,https://www.huffpost.com/entry/daughters-first-period_n_5eb40755c5b6526942a2eb65
94,0,Pittsburgh Journalists And Mayor Support Black Reporter Pulled From Covering Protests,https://www.huffpost.com/entry/pittsburgh-reporter-protest-tweet-alexis-johnson_n_5edc28efc5b6b204a6a2e974
95,0,My Mom Has Alzheimer’s And COVID-19. I Can't Visit Her And It’s Traumatizing.,https://www.huffpost.com/entry/alzheimers-coronavirus-not-allowed-to-visit-hospital_n_5e98a37fc5b675bebe36aed3
96,0,Tear Gas Is Banned In Warfare But Not Against Protesters. A New Bill Could Change That.,https://www.huffpost.com/entry/tear-gas-ban-police-departments-protesters_n_5ee1015ec5b637cebe726ccb
97,0,Anthony Fauci Warned White House That Tulsa Rally Would Be Dangerous: Report,https://www.huffpost.com/entry/anthony-fauci-trump-tulsa-rally-risk_n_5eed377cc5b6d30db989a225
98,0,Rebecca Black Told Us To 'Get Down' On Friday. But How Do We Do It During A Pandemic?,https://www.huffpost.com/entry/rebecca-black-friday-music_n_5ebc2189c5b6d3c51ecdd9bc
99,0,New York Legislature Votes To Repeal Law Shielding Police Disciplinary Records,https://www.huffpost.com/entry/new-york-repeal-law-police-records_n_5ee02866c5b66095792ae996
100,0,This Is What It’s Like To Have OCD During The Coronavirus Pandemic,https://www.huffpost.com/entry/ocd-covid-19-pandemic_n_5e792011c5b6f5b7c5496b49
101,0,I Want To Go Home To The U.S During The Coronavirus Outbreak. But Here's Why I Won't.,https://www.huffpost.com/entry/coronavirus-health-care-united-states-europe-abroad_n_5e7cdfd0c5b6cb9dc19c449c
102,0,Drive-Thru Strip Club Serves Up Sexy (And Safe) Solution For Coronavirus Blues,https://www.huffpost.com/entry/drive-thru-strip-club-coronavirus_n_5eac4c0ec5b624b39692963d
103,0,Senate Passes Major Public Lands Bill,https://www.huffpost.com/entry/senate-great-american-outdoors-act_n_5ee2e2e8c5b67a2efedcb6e7
104,0,Facebook Engineer Resigns Over Zuckerberg's Handling Of Trump Posts,https://www.huffpost.com/entry/tim-aveni-facebook-engineer-quit-trump_n_5ed68a8ec5b602ef3409d38a
105,0,I'm An AIDS Survivor And COVID-19 Is Giving Me Flashbacks,https://www.huffpost.com/entry/aids-epidemic-covid-19-pandemic_n_5eb441ccc5b6b92917060e77
106,0,Want To Know Why People Stockpile Toilet Paper? I'm A Hoarder And I Have A Few Ideas.,https://www.huffpost.com/entry/coronavirus-toilet-paper-hoarding_n_5e7a2320c5b62f90bc51e1db
107,0,House Leadership Announces Upcoming Vote On D.C. Statehood,https://www.huffpost.com/entry/house-leadership-announces-upcoming-vote-on-dc-statehood_n_5ee92d13c5b67912c6a87b28
108,0,Coronavirus Live Updates: Read The Latest About The COVID-19 Outbreak,https://www.huffpost.com/entry/covid-19-latest-updates-across-world_n_5ed7a886c5b6489c7fdd10d1
109,0,I Wish Someone Had Told Me I Wouldn't Immediately Love My Newborn,https://www.huffpost.com/entry/i-didnt-love-my-newborn-right-away_n_5e68fae5c5b60557280f1f69
110,0,John Kelly Slams Trump's Ethics: 'We Need To Look Harder At Who We Elect',https://www.huffpost.com/entry/john-kelly-trump-ethics_n_5eda803bc5b66ef1a924877b
111,0,"Colin Powell Says He 'Cannot In Any Way' Support Trump, Will Vote For Joe Biden",https://www.huffpost.com/entry/colin-powell-vote-for-joe-biden_n_5edce826c5b65c62d3d27fe3
112,0,Mississippi Set To Become The 13th State To Criminalize Fossil Fuel Protests,https://www.huffpost.com/entry/mississippi-fossil-fuels_n_5ee92dc6c5b6273a4c50ee38
113,0,To Celebrities Who Say Teachers Should Make Millions: Put Your Money Where Your Mouth Is,https://www.huffpost.com/entry/teacher-appreciation-celebrity-shoutouts-how-to-help_n_5eb96e49c5b6f5eb6afdfeb5
114,0,Fox News' John Roberts Uses War Analogy To Describe Preparing For Trump Rally In Pandemic,https://www.huffpost.com/entry/fox-news-john-roberts-donald-trump-tulsa-rally-coronavirus_n_5eedb755c5b69bae7d63db56
115,0,Amber Riley On Lea Michele Drama: 'I Don’t Give A S**t. People Are Out Here Dying',https://www.huffpost.com/entry/amber-riley-lea-michele-glee_n_5ed9069ec5b65756275842cf
116,0,'Live PD' Dropped By A&E On Heels Of 'Cops' Cancellation,https://www.huffpost.com/entry/live-pd-dropped-by-ae_n_5ee1e96ac5b6e827df13d99e
117,0,Olivia Jade's 'White Privilege' Speech Backfires,https://www.huffpost.com/entry/olivia-jade-white-privliege-george-floyd_n_5ed63c83c5b6ccd7c56b9ea6
118,0,'I Am George Floyd': NFL Star Von Miller Writes Powerful Essay On Racism,https://www.huffpost.com/entry/von-miller-george-floyd-essay-racism_n_5ee0f21dc5b6cdc3fd4374dd
119,0,Mark Cuban: White People 'Get Defensive' When Discussing White Privilege,https://www.huffpost.com/entry/mark-cuban-white-privilege_n_5ee00fa4c5b683b5ef6eee6d
120,0,Social Distancing Feels A Lot Like My Immigrant Childhood. Here's How.,https://www.huffpost.com/entry/social-distancing-coronavirus-immigrant-childhood_n_5ea3240fc5b6d376358f1d00
121,0,"Through Food, Padma Lakshmi Explores What It Means To Be American",https://www.huffpost.com/entry/padma-lakshmi-taste-the-nation_n_5ee2a1a8c5b67266c4d5d226
122,0,Coronavirus Live Updates: Read The Latest About The COVID-19 Outbreak,https://www.huffpost.com/entry/covid-19-latest-news-worldwide_n_5ee76fcfc5b6f5b0d4634c9c
123,0,US Attorney Who Oversaw Cases Of Trump Allies Steps Down,https://www.huffpost.com/entry/geoffrey-berman-oversaw-trump-allies-steps-down_n_5eed7723c5b61735147d79d6
124,0,Pentagon Threat Sparked Shocking Crackdown On Protesters For Trump Photo Op: Report,https://www.huffpost.com/entry/pentagon-trump-washington-dc-national-guard-protest_n_5edc244fc5b6dcf35913b20e
125,0,"Trump Is Opposed To 'Kneeling In General,' Raising Hell With Religious Worship",https://www.huffpost.com/entry/trump-kneeling-religions-twitter-mcenany_n_5edeec59c5b6fdc1523d1342
126,0,"Lady Antebellum, Blues Artist Lady A Had 'Honest' Talk On Name Change Controversy",https://www.huffpost.com/entry/lady-antebellum-lady-a-name-change_n_5ee8e8dac5b6dff8f98e1b82
127,0,"Jennifer Lawrence Joins Twitter, Immediately Demands Justice For Breonna Taylor",https://www.huffpost.com/entry/jennifer-lawrence-joins-twitter-breonna-taylor_n_5eeb6c0fc5b6c8594c7f05b1
128,0,Banksy Suggests What To Do With Toppled Statue Of Slave Trader,https://www.huffpost.com/entry/banksy-slave-trader-statue-replace_n_5ee213c8c5b68c338976c108
129,0,Pence Tells Governors To Share Misleading Facts About Coronavirus Infections: Reports,https://www.huffpost.com/entry/pence-governors-coronavirus-call_n_5ee83b5cc5b6b735a6483671
130,0,Trevor Noah Shames Police Brutality With 1 Brutal Observation,https://www.huffpost.com/entry/trevor-noah-police-brutality-george-floyd_n_5edf53cdc5b6f482a40b5779
131,0,"50 Years After MLK, Pastors Lead A New Poor People's March",https://www.huffpost.com/entry/poor-peoples-campaign-2020_n_5eecc7d1c5b6c7578fff14d1
132,0,Navy Upholds Firing Of Carrier Captain In Virus Outbreak,https://www.huffpost.com/entry/navy-upholds-firing-of-carrier-captain-in-virus-outbreak_n_5eed081bc5b6d30db989773d
133,0,Virginia Governor To Propose Juneteenth As State Holiday,https://www.huffpost.com/entry/virginia-juneteenth-state-holiday-northam_n_5ee91e8fc5b67912c6a8637d
134,0,"Overwhelmed By COVID-19, India To Transform Train Cars Into Makeshift Hospital Wards",https://www.huffpost.com/entry/india-coronavirus-train-hospitals_n_5ee713e7c5b64e08725a0e2f
135,0,Roger Goodell Encourages NFL Teams To Sign Colin Kaepernick,https://www.huffpost.com/entry/roger-goodell-colin-kaepernick-encouraging_n_5ee8edc0c5b6f5b5484eb4c3
136,0,Malala Graduates From Oxford 8 Years After Surviving Taliban Gunmen,https://www.huffpost.com/entry/malala-graduates-oxford-university_n_5eec8c73c5b69d4e087665a9
137,0,Conan O'Brien Wisely Shuts Up On George Floyd And Listens Instead,https://www.huffpost.com/entry/conan-obrien-george-floyd_n_5ed61a30c5b6ccd7c56b709e
138,0,Belgian Prince Tests Positive For Coronavirus After Attending Party In Spain,https://www.huffpost.com/entry/belgian-prince-covid-19-test-positive-spain_n_5ed694edc5b68503368684a4
139,0,Confederate Statue Taken Down In Virginia,https://www.huffpost.com/entry/confederate-statue-taken-down-in-virginia_n_5ed671dcc5b61df4ef481d8d
140,0,Trump’s Mar-a-Lago Broken Promise Does Not Affect His Ability To Vote From There,https://www.huffpost.com/entry/trump-mar-a-lago-voting-by-mail_n_5edeab1dc5b6e255ae67d67f
141,0,Trump’s Occupation Of D.C. Fuels Calls For Statehood,https://www.huffpost.com/entry/donald-trump-dc-statehood-district-of-columbia_n_5eda6596c5b6ff96049fa5ca
142,0,My Body Should Not Be Your New Favorite Coronavirus Quarantine Punchline,https://www.huffpost.com/entry/fat-shaming-memes-coronavirus_n_5ea2f6d5c5b6f9639813b568
143,0,Joe Biden Doubles Down On His Stance Against Defunding The Police,https://www.huffpost.com/entry/daily-show-joe-biden-interview_n_5ee1be1fc5b65a7f2d98d081
144,0,"After Just Weeks Of Dating, My Boyfriend And I Are In Coronavirus Lockdown Together",https://www.huffpost.com/entry/covid-19-couple-lockdown-love-apartment-paris_n_5e8628a0c5b6d302366ca9a7
145,0,Donald Trump’s ‘Chinese Virus’ Coronavirus Tweet Has Me Scared For My Family,https://www.huffpost.com/entry/trump-chinese-virus-coronavirus_n_5e722040c5b63c3b648828aa
146,0,I Study Human Touch. I'm Questioning What Our Future Will Be Like After COVID-19.,https://www.huffpost.com/entry/human-touch-covid19_n_5eb2da79c5b6f8deb4ead85b
