,is_sarcastic,titles,article_link
581,0,"John Bolton: Trump Not Fit For Office, Putin Thinks He Can 'Play Him Like A Fiddle'",https://www.huffpost.com/entry/john-bolton-donald-trump-not-fit-for-office_n_5eeb46a5c5b6306008bacfff
582,0,I Love My White Boyfriend But There’s One Thing He Can Never Understand,https://www.huffpost.com/entry/interracial-couple-ahmaud-arbery_n_5ec52bc1c5b6f7d6e2539409
583,0,UK Stats Watchdog Slams Matt Hancock's 'Misleading' Testing Figures,https://www.huffpost.com/entry/matt-hancocks-misleading-testing-figures-slammed-by-uk-stats-watchdog_n_5ed7a1b6c5b67fa4073be10f
584,0,"As A Disabled Person, I'm Afraid I May Not Be Deemed Worth Saving From The Coronavirus",https://www.huffpost.com/entry/coronavirus-healthcare-rationing-medical-ethics-disability_n_5e7a2b0dc5b6f5b7c54bb117
585,0,'The Walking Dead' Star Khary Payton Introduces His Transgender Son To The World,https://www.huffpost.com/entry/walking-dead-khary-payton-transgender-son-karter_n_5ee8c799c5b64c03ad9419a0
586,0,Prince Harry Supports Decision To Review Singing Of Slave Song At Rugby Games,https://www.huffpost.com/entry/prince-harry-slave-song-rugby_n_5eefb973c5b632720d39c3b1
587,0,"In ‘Da 5 Bloods,’ Spike Lee Provides A Fresh Return To The Heart Of Darkness",https://www.huffpost.com/entry/da-5-bloods-spike-lee-apocalypse-now-netflix_n_5ee12c99c5b6afd52760e7dc
588,0,Scathing Supercut Shows How Quickly Trump Flips On His Once Most Trusted Aides,https://www.huffpost.com/entry/donald-trump-officials-criticism-supercut_n_5eeda91cc5b61735147d8bc1
589,0,Uncle Ben’s ‘Evolving’ Its Brand Identity After Aunt Jemima Name Change,https://www.huffpost.com/entry/uncle-bens-evaluating-brand-aunt-jemima-name-change_n_5eea18f1c5b69322bc19a688
590,0,"After Criticism, Ellen DeGeneres Expands Thoughts On Black Lives Matter",https://www.huffpost.com/entry/ellen-degeneres-george-floyd-black-lives-matter-response_n_5ed66cbbc5b682d7d88e78d2
591,0,TikTok Comedian Sarah Cooper Spills Secrets On Lip-Synching Trump In Jimmy Fallon Interview,https://www.huffpost.com/entry/sarah-cooper-jimmy-fallon-trump-tiktok_n_5ee4eaa8c5b638339d1d8bec
592,0,John Oliver Expertly Disarms Right-Wing Talking Points Over 'Defund The Police',https://www.huffpost.com/entry/john-oliver-defind-the-defund-the-police_n_5edde9f1c5b6c29d19fe7dfd
593,0,"Coronavirus Cases Surge In Alabama, South Carolina And Oklahoma",https://www.huffpost.com/entry/coronavirus-cases-surge-alabama-south-carolina-oklahoma_n_5ee8f1cec5b6bf41e35275e7
594,0,Protests Spark Renewed Outcry Over Black Teen’s 55-Year 'Accomplice' Prison Sentence,https://www.huffpost.com/entry/lakeith-smith-petition-alabama_n_5ee762cac5b6c2be9cb8e804
595,0,'Coward And Commander': Jim Mattis Attack On Trump Stars In Lacerating Ad,https://www.huffpost.com/entry/lincoln-project-jim-mattis-donald-trump-ad_n_5edae5bfc5b62955a856db84
596,0,"'Ellen' Removes Cigars From Michael Jordan Documentary, And It's Weird",https://www.huffpost.com/entry/ellen-cigars-michael-jordan-documentary-last-dance_n_5ee79b1dc5b667467ff50dea
597,0,Protests Continue In U.S. After Deaths Of More Black Men,https://www.huffpost.com/entry/protests-continue-after-deaths-of-more-black-men_n_5ee661e8c5b69158227020ed
598,0,Raven-Symoné Reveals Secret Marriage To Miranda Maday In Sweet Message,https://www.huffpost.com/entry/raven-symone-secret-wedding-miranda-maday_n_5eeb9467c5b60490b9a226a3
599,0,Tyler Perry Is 'Taking Care' Of Rayshard Brooks' Funeral,https://www.huffpost.com/entry/tyler-perry-rayshard-brooks-funeral_n_5ee7bfd1c5b6d4b2199c2cf6
600,0,I Had To Decide Whether To Recommend My Rapist Be Paroled During The Pandemic,https://www.huffpost.com/entry/rapist-parole-covid-19-prison_n_5ec6f84ac5b635450f38142a
601,0,"More Than 10,000 People Reportedly Arrested At U.S. Protests",https://www.huffpost.com/entry/10000-people-reportedly-arrested-at-us-protests_n_5ed8b55bc5b6f3c22ef01fc4
602,0,Brit Hume Slams Biden’s Call For Racial Justice As ‘Black Grievance Politics’,https://www.huffpost.com/entry/brit-hume-black-grievance-politics_n_5ed70f23c5b68e90298a5bd2
603,0,Genetically Modified 'Friendly' Mosquitoes Approved For Insect Population Control In the U.S.,https://www.huffpost.com/entry/oxitec-genetically-modified-mosquitoes_n_5eeb978dc5b6674372343148
604,0,Trump Administration Hints At Support For A Smaller Unemployment Boost,https://www.huffpost.com/entry/unemployment-benefits-coronavirus_n_5ee0e740c5b6331c233e3929
605,0,Ex-Trump Aide Sebastian Gorka May Get Role Atop Voice Of America: Report,https://www.huffpost.com/entry/voa-cdc-trump-usgma-michael-pack-seb-gorka_n_5ee83716c5b693c5d0de3c18
606,0,"Republicans Move Convention Events, Trump Nomination Acceptance To Jacksonville, Florida",https://www.huffpost.com/entry/republican-national-convention-jacksonville-florida_n_5ee2cf4dc5b668204dc2ae75
607,0,What Living In A Buddhist Monastery Taught Me About Getting Through Quarantine,https://www.huffpost.com/entry/buddhist-monastery-covid-19-quarantine_n_5e84b1dec5b65dd0c5d7d684
608,0,Justice Department Seeks Restraining Order Against John Bolton Over New Book,https://www.huffpost.com/entry/bolton-restraining-order-book-us-government-trump_n_5eeab41bc5b6959c7e8d3147
609,0,"Hulu’s ‘Love, Victor’ Is A Welcome Diversion For An LGBTQ Pride Month Like No Other",https://www.huffpost.com/entry/hulu-love-victor-queer-teen-series-michael-cimino_n_5ee3fcecc5b618c2c5de76e2
610,0,Trump Rips Supreme Court Ruling That Saves DACA: 'Shotgun Blasts Into The Face',https://www.huffpost.com/entry/trump-responds-daca-supreme-court_n_5eeb7557c5b6d71fb14fb7b8
611,0,Trump Suggests Stopping COVID-19 Tests Would Result In Fewer Cases,https://www.huffpost.com/entry/trump-no-covid-19-tests-no-covid-19_n_5ee7cc27c5b69e917f1d3b2b
612,0,"Twitter Axes 32,000 State-Linked Propaganda Accounts From Russia, China And Turkey",https://www.huffpost.com/entry/twitter-china-russia-turkey-accounts-trump-election_n_5ee2f717c5b6cea9276d893c
613,0,Trump Defends Racist Phrase By Citing Philadelphia's Infamous ‘Vote White’ Mayor,https://www.huffpost.com/entry/donald-trump-frank-rizzo-looting_n_5ee2dce9c5b67a2efedcb0a7
614,0,Kate Middleton Took The Cutest Pics Of William And The Cambridge Kids,https://www.huffpost.com/entry/kate-middleton-prince-william-kids-photos_n_5ef0b80bc5b64bb020306eb8
615,0,"TSA Worsened Coronavirus Pandemic, Whistleblower Says",https://www.huffpost.com/entry/tsa-coronavirus-whistleblower_n_5eece54dc5b65f65308b9b7a
616,0,Trump Floats Conspiracy That 75-Year-Old Buffalo Protester Pushed By Police Was 'A Set Up',https://www.huffpost.com/entry/trump-buffalo-protester-conspiracy_n_5edf83abc5b645921dbc8401
617,0,"I’m No Longer A Woman, But I Want To Be Part Of Women’s History Month. Here’s Why.",https://www.huffpost.com/entry/nonbinary-gender-feminism-supporter-womens-history-month_n_5e6a57b1c5b6bd8156f31a5f
618,0,The COVID-19 Panic Created A Shortage Of My Life-Saving Meds. I'm Afraid I Won't Make It.,https://www.huffpost.com/entry/hydroxychloroquine-lupus-plaquenil-coronavirus-deaths-united-states_n_5e84b079c5b6a1bb76514b04
619,0,Israel Hawks Are Scrambling To Save Democratic Rep. Eliot Engel,https://www.huffpost.com/entry/pro-israel-groups-bronx-democrat-eliot-engel-jamaal-bowman-new-york-primary_n_5eea81abc5b6a23180b782b9
620,0,"Our Federal Government Has Failed To Protect Us, And We Have Every Right To Feel Traumatized",https://www.huffpost.com/entry/federal-government-failed-to-protect-us-right-to-feel-traumatized_n_5e6a80e7c5b6bd8156f3a2b4
621,0,Jim Carrey Puts A Cartoon Spin On Trump's New Twitter Record,https://www.huffpost.com/entry/jim-carrey-donald-trump-twitter-cartoon_n_5eeb194fc5b6eab8ed9c6b8f
622,0,White House Adviser: No 'Transparency' Promise Ever Made Over Billions In Loans,https://www.huffpost.com/entry/larry-kudlow-steven-mnuchin-ppp-transparency_n_5ee65fcfc5b6efec77585b4c
623,0,Trump Demeans Female Black Reporter As She Challenges Him On Black Unemployment,https://www.huffpost.com/entry/yamiche-alcindor-trump-black-unemployment-briefing_n_5edad2d7c5b685414767ddd1
624,0,Rachel Griffiths Sorry For Flaunting Manicure While 'People Are Dying' After Backlash,https://www.huffpost.com/entry/rachel-griffiths-manicure-apology_n_5ed94336c5b694927ef7887a
625,0,Barbra Streisand Gives Disney Stock To George Floyd's Daughter Gianna,https://www.huffpost.com/entry/barbra-streisand-george-floyd-gianna-disney-stock_n_5ee73e84c5b69f21912132f5
626,0,Conservative Columnist Underscores The Magnitude Of What Bolton’s Book Reveals,https://www.huffpost.com/entry/max-boot-john-bolton-book-donald-trump_n_5eec76d3c5b62389aa820cb6
627,0,Biden Comes This Close To Dropping An F-Bomb On Trump's 'Very Fine' Racists,https://www.huffpost.com/entry/biden-trump-racist-folks_n_5ee3069ac5b67fa8b89227b4
628,0,Minneapolis Agrees To Ban Police Chokeholds After George Floyd's Death,https://www.huffpost.com/entry/minneapolis-police-chokeholds-george-floyd_n_5eda7d75c5b629130d7823b0
629,0,I Thought I Totally Understood Gender And Sexuality. Then My Son Asked For Pink Shoes.,https://www.huffpost.com/entry/parents-understanding-kids-gender-sexuality_n_5e67e97fc5b68d61645c2948
630,0,Jimmy Kimmel Rates Donald Trump's Chances Of Unifying The Country,https://www.huffpost.com/entry/jimmy-kimmel-donald-trump-unifying-country_n_5edf60aac5b6bd09bd991eed
631,0,'Harry Potter' Stars Are Assembling Dumbledore's Army-Style To Call Out J.K. Rowling,https://www.huffpost.com/entry/harry-potter-stars-are-assembling-dumbledores-army-style-to-call-out-jk-rowling_n_5ee0de98c5b6cdc3fd432d6c
632,0,PM Defends Joining Huge Anti-Racism Protest Despite Urging Social Distancing,https://www.huffpost.com/entry/trudeau-defends-joining-ottawa-anti-racism-protest-despite-urging-social-distancing_n_5ee0fde3c5b65e0022056339
633,0,"Tennessee Must Allow Vote By Mail For All Amid Coronavirus Pandemic, Judge Rules",https://www.huffpost.com/entry/tennessee-vote-by-mail-ruling_n_5ed9ffb4c5b6bc618d781a52
634,0,"In Veto-Proof Majority, Minneapolis City Council Says It Will Dismantle Police Department",https://www.huffpost.com/entry/minneapolis-city-council-dismantle-police-department_n_5edd7d7dc5b6bd197e141c05
635,0,"To Survive This Era, Writers Must Rejoin The Working Class",https://www.huffpost.com/entry/jason-boog-the-deep-end-publishing_n_5ee7a0c3c5b6aa0b5b272098
636,0,"Journalist Maria Ressa, Critic Of Rodrigo Duterte, Convicted Of Libel",https://www.huffpost.com/entry/journalist-maria-ressa-libel-verdict_n_5ee75199c5b619db1d9941b6
637,0,Kumail Nanjiani's Tweet Brilliantly Rejects Idea Of Few ‘Bad Apple’ Cops In Buffalo,https://www.huffpost.com/entry/kumail-nanjiani-buffalo-police-bad-apple_n_5eda0cd4c5b6df553f390fdb
638,0,Rubber Bullets Are Still Bullets,https://www.huffpost.com/entry/rubber-bullets-deadly-protests-police-george-floyd_n_5eda9e47c5b68a90de7688de
639,0,'Game Of Thrones' Stars Reunite To Play An Actual Game Of Thrones,https://www.huffpost.com/entry/game-of-thrones-stars-reunite-to-play-an-actual-game-of-thrones_n_5ee38d51c5b6cac560da0361
640,0,Chyler Leigh Opens Up About Discovering Her Sexuality In Pride Month Essay,https://www.huffpost.com/entry/chyler-leigh-sexuality-pride-month-essay-supergirl_n_5ee0ede0c5b6147d60257879
641,0,I Was Set To Become An Elite Athlete This Year. Instead I Got A Job At A Grocery Store.,https://www.huffpost.com/entry/professional-athlete-marathon-coronavirus-grocery-store_n_5ec292f7c5b65ac201e5c5ce
642,0,"Bernie Sanders Endorses Jamaal Bowman, Five Other Progressive Candidates For Congress",https://www.huffpost.com/entry/bernie-sanders-endorses-jamaal-bowman-new-york-house-primary-eliot-engel_n_5edfa67fc5b6972f8b21ac03
643,0,Effigy Found Near California Park Where Nooses Were Recently Removed,https://www.huffpost.com/entry/effigy-lake-merritt-nooses-oakland_n_5eebc933c5b6d9234ce7c4b3
644,0,Scant Evidence For Trump Claim That Antifa Is Behind Protest Violence,https://www.huffpost.com/entry/trump-antifa-protests-wrong_n_5edbd47bc5b602afd0cf5dfe
645,0,Video Of Keke Palmer Urging Armed National Guard To 'March With Us' Goes Viral,https://www.huffpost.com/entry/keke-palmer-george-floyd-protests-viral-video_n_5ed77eb4c5b685c4f29909e1
646,0,Honduras President Hospitalized With COVID-19 And Pneumonia,https://www.huffpost.com/entry/honduras-president-coronavirus_n_5eeb14d3c5b6117abf7316d9
647,0,"Black Man's Death In Police Custody Was Filmed For 'Live PD,' Prosecutor Says",https://www.huffpost.com/entry/police-brutality-live-pd_n_5edf8034c5b6c7a1fb1f4bb2
648,0,"Philadelphia Inquirer's Top Editor Resigns After 'Buildings Matter, Too' Headline",https://www.huffpost.com/entry/philadelphia-inquirer-editor-resigns_n_5edcd1d1c5b62cff53f41dd6
649,0,"Storm Season Adds To Coronavirus Pandemic Worries For Mexico, Central America",https://www.huffpost.com/entry/2020-storm-season-coronavirus_n_5ed9f405c5b68843ed2fa7e6
650,0,"In An Election Year, 2 Vulnerable GOP Senators Are Suddenly Conservationists",https://www.huffpost.com/entry/lwcf-great-american-outdoors-act_n_5ee26655c5b6fdbc0a8e5ff1
651,0,Young COVID-19 Patient Becomes First In U.S. To Receive Double Lung Transplant,https://www.huffpost.com/entry/covid-19-double-lung-transplant-chicago_n_5ee2bcc0c5b657fdea4a7309
652,0,7 Races To Watch On The First Big Primary Day Of The Pandemic,https://www.huffpost.com/entry/seven-races-to-watch-on-the-first-big-primary-day-of-the-pandemic_n_5ed5f2f7c5b6e87a67b924a9
653,0,COVID-19 And Protests: Views from HuffPost Readers,https://www.huffpost.com/entry/covid19-protests-views-from-huffpost-readers_n_5eea2774c5b6f5fae1daf029
654,0,Banksy's New Anti-Racism Artwork Sets Fire To The American Flag,https://www.huffpost.com/entry/banksy-racism-protests-george-floyd-art_n_5edb81cdc5b6da5b98912dfc
655,0,Samantha Ware: 'Glee' Co-Star Lea Michele Threatened To Get Me Fired,https://www.huffpost.com/entry/glee-samantha-ware-lea-michele-firing_n_5ee37b06c5b6f2cb034fc155
656,0,"This Is What I Want To Tell My White Professors When They Ask, 'How Are You Today?'",https://www.huffpost.com/entry/black-medical-student-wants-white-professors-to-know_n_5ed91238c5b6e0feefc26315
657,0,Tennessee Lawmakers Advance 6-Week Abortion Ban In Overnight Vote,https://www.huffpost.com/entry/tennessee-abortion-bill_n_5eec70cbc5b6b7546347a6d1
658,0,How Indie Theaters Are Reimagining The Moviegoing Experience,https://www.huffpost.com/entry/independent-movie-theaters-coronavirus_n_5ed534cac5b645ff4afb23e7
659,0,California Vows To Take Steps To Protect Protesters From Police Abuse,https://www.huffpost.com/entry/california-protect-protesters-police-abuse_n_5edaa19ec5b640424ef71be9
660,0,"Trump's 'Racist' Toddler Video Removed By Facebook,Twitter After Parent Complains",https://www.huffpost.com/entry/racist-toddlers-trump-twitter-facebook-copyright-violation_n_5eed5a24c5b627cd16bdeccf
661,0,GOP Senate Candidate Warns America Is 'Up Against Multiculturalism',https://www.huffpost.com/entry/corky-messner-candidate-new-hampshire-multiculturalism_n_5eda9a50c5b6ba25316d975f
662,0,White House Steps Up Effort To Downplay Coronavirus Concerns,https://www.huffpost.com/entry/trump-white-house-downplays-coronavirus_n_5ee99531c5b695286b78c1ea
663,0,Judge Doubts White House Can Keep Bolton Book Away From Public,https://www.huffpost.com/entry/judge-bolton-book-white-house_n_5eed17d0c5b69a744383385f
664,0,Dr. Sanjay Gupta: Trump Rally Is ‘Worst-Case Scenario’ For Spreading Coronavirus,https://www.huffpost.com/entry/cnn-sanjay-gupta-donald-trump-rally-coronavirus_n_5ee871fbc5b6b275c04f8d69
665,0,Caitlyn Jenner Reflects On Her Emotional Journey 5 Years After Coming Out,https://www.huffpost.com/entry/caitlyn-jenner-transition-fifth-anniversary_n_5ee152fdc5b6f76404de5748
666,0,"I'm A Doctor In A COVID-19 Unit. Before You Call Me A Hero, Here's What You Should Know.",https://www.huffpost.com/entry/doctor-covid-19-pandemic-hero_n_5eac470dc5b65156135ccc9e
667,0,Southern Baptists Report Biggest Single Year Membership Drop In Decades,https://www.huffpost.com/entry/southern-baptist-membership_n_5eda7c43c5b695fc9e8f9ca6
668,0,Here's How Much It Really Costs To Be An Online Sex Worker,https://www.huffpost.com/entry/online-sex-work-cam-only-fans-covid-19_n_5e8de205c5b6359f96d0c2d4
669,0,Colbert Schools Trump With A Scathing Reminder Of How Strongman Rulers End,https://www.huffpost.com/entry/stephen-colbert-donald-trump-bunker_n_5ed5e92fc5b651b2b3176d02
670,0,"Once The Pandemic Is Over, Can We Keep The World This Accessible?",https://www.huffpost.com/entry/accessibility-covid-19-pandemic_n_5ea6e11dc5b6a30004e57bc3
671,0,"Philadelphia Inquirer Staffers Launch Protest After Newspaper's 'Buildings Matter, Too' Headline",https://www.huffpost.com/entry/philadelphia-inquirer-staffers-launch-protest-after-newspapers-buildings-matter-too-headline_n_5ed8fa40c5b69b39db20bf25
672,0,I'm A Doctor. The U.S. Response To Coronavirus Has Been Nothing Short Of Criminal.,https://www.huffpost.com/entry/doctors-covid-19-united-states-response_n_5e74ba42c5b63c3b648e9014
673,0,"Naming Bases For Confederate Generals Is Like Having A Camp Bin Laden, Charges Vets' Ad",https://www.huffpost.com/entry/votevets-ad-osama-bin-laden-confederacy-military-bases_n_5ee3f341c5b65d77bafbe1af
674,0,12 Amazing Photos You Missed This Week,https://www.huffpost.com/entry/amazing-photos-you-missed-this-week_n_5ee3f518c5b699cea5319e06
675,0,Trump Claims He Went To White House Bunker During Protests 'For An Inspection',https://www.huffpost.com/entry/trump-bunker-inspection-protests_n_5ed7a4d7c5b657757ee76c31
676,0,My 88-Year-Old Grandma Isn't Taking Coronavirus Seriously Enough And It's Terrifying,https://www.huffpost.com/entry/grandparents-coronavirus-worried-stubborn_n_5e74318bc5b6eab779455867
677,0,Big Oil Wanted Changes To Worker Safety Rule. Emails Show Trump Official ‘Agreed.’,https://www.huffpost.com/entry/trump-offshore-oil-worker-safe_n_5ed68055c5b68dc7fbdd367b
678,0,NASCAR Bans Confederate Flag At Its Events And Properties,https://www.huffpost.com/entry/nascar-confederate-flag-ban_n_5ee14983c5b67927a8aae647
679,0,Trump Orders Withdrawal Of National Guard In D.C. As Anti-Racism Protests Continue,https://www.huffpost.com/entry/trump-withdraws-national-guard-dc_n_5edcfc79c5b61fd1718533d3
680,0,'Beyond Gaslighting': NY Times Ripped For 'Pathetic' Front-Page Trump Coverage,https://www.huffpost.com/entry/ny-times-trump-military-protesters_n_5ed5d80dc5b651b2b3175e71
681,0,"I Left My Conservative Hometown To Come Out. Now, I’m Back (With My Girlfriend).",https://www.huffpost.com/entry/conservative-hometown-covid-19-pandemic_n_5ee251c6c5b69fc14df94c1a
682,0,The Militarization Of Local Police Has Been Decades In The Making,https://www.huffpost.com/entry/the-militarization-of-local-police-has-been-decades-in-the-making_n_5ed6d003c5b6a4e38f6a4fd6
683,0,"Trump 'Exploited Sacred Symbols,' Says Church Where He Married Melania",https://www.huffpost.com/entry/trump-church-sacred-symbols-protests_n_5ee4a4edc5b670a0b39b3e0b
684,0,"Fauci Urges Trump Rally Attendees To Wear Masks, Says Large Events Remain ‘Risky’",https://www.huffpost.com/entry/fauci-trump-rallies-protests-risky-coronavirus_n_5ee3e7eac5b62540994fe1ad
685,0,"As Greens Reckon With Racism, Staff At A Major Group Challenge Pro-Trump Board Member",https://www.huffpost.com/entry/world-resources-institute-stephen-ross-trump_n_5ee2f0fbc5b67a2efedcc7f3
686,0,I Just Got Out Of The COVID-19 ICU. Here's How I Made It Through.,https://www.huffpost.com/entry/covid-19-icu-patient_n_5e824ef8c5b62dd9f5d40f05
687,0,"Beyoncé's Powerful Graduation Speech About Black Lives, Sexism Is One We All Need To Hear",https://www.huffpost.com/entry/beyonc%C3%A9s-powerful-graduation-speech-about-racism-and-sexism-is-one-we-all-need-to-hear_n_5ede342bc5b68aebd011c323
688,0,Court Says Trump Rally Attendees Don't Have To Wear Masks,https://www.huffpost.com/entry/court-trump-rally-masks_n_5eed13abc5b6786f1b4dc829
689,0,States Have Put 54 New Restrictions On Peaceful Protests Since Ferguson,https://www.huffpost.com/entry/anti-protest-laws-free-speech_n_5ed958c3c5b6a11919831bb3
690,0,Donald Trump Pokes At Roger Goodell For Encouraging NFL Player Protests,https://www.huffpost.com/entry/donald-trump-roger-goodell-tweet_n_5ede1eedc5b615b2c11aeb83
691,0,"As Protests Swell, Trump Vows To Unleash Military Against Anti-Racist Demonstrations",https://www.huffpost.com/entry/trump-threatens-deploy-military-against-anti-racist-protesters_n_5ed591f7c5b66eacb217a32e
692,0,"Russia Sets Up 'Disinfection Tunnel' To Protect Putin From Virus, State Media Says",https://www.huffpost.com/entry/russia-disinfection-tunnel-to-protect-putin_n_5ee9e033c5b6e63de82c6c40
693,0,NASCAR’s Bubba Wallace Calls For Confederate Flags To Be Banned From Tracks,https://www.huffpost.com/entry/bubba-wallace-confederate-flag_n_5ee04c89c5b61417f817cb2f
694,0,Health Expert Calls Trump's Tulsa Rally 'Extraordinarily Dangerous Move’,https://www.huffpost.com/entry/trump-tulsa-rally-coronavirus-dangerous_n_5ee61910c5b6734d8c9112ce
695,0,Trump Went Full-On Fascist For A Photo-Op. What’s He Willing To Do To Keep Power?,https://www.huffpost.com/entry/trump-fascist-reelection-authoritarianism_n_5ed816e5c5b6c0b2f10e5775
696,0,'We Have No Choice': Minneapolis City Council President Wants To 'Dismantle' The Police,https://www.huffpost.com/entry/minneapolis-george-floyd-city-council_n_5ed9c954c5b639da7b399c1c
697,0,Stephen Colbert Shreds Trump's Supreme Court Gripe With A KKK Zinger,https://www.huffpost.com/entry/stephen-colbert-donald-trump-supreme-court-kkk_n_5eec823dc5b6b734e34e2983
698,0,Disneyland Plans To Reopen July 17 Following Coronavirus Closure,https://www.huffpost.com/entry/disneyland-california-reopening-coronavirus_n_5ee15941c5b610a273b20f77
699,0,I’m Sheltering In Place With My In-Laws … And It's Actually Amazing. Here's Why.,https://www.huffpost.com/entry/covid-19-shelter-in-place-in-laws_n_5ea198b9c5b69150246e998f
700,0,HBO Is Now Letting You Watch 'Watchmen' For Free,https://www.huffpost.com/entry/hbo-watchmen-for-free_n_5eeb9037c5b6472b3d47fdf0
701,0,'S**thole' Countries Have Handled The Coronavirus Better Than The United States,https://www.huffpost.com/entry/developing-countres-coronavirus-united-states-global-south_n_5edaa785c5b6dc3de7b94546
702,0,Rep. Ilhan Omar’s Father Dies From Complications Of COVID-19,https://www.huffpost.com/entry/ilhan-omar-father-coronavirus-death_n_5ee80d2fc5b6a5c86534c853
703,0,Sean Hannity Claims Trump Is Also A Victim Of Crooked Cops: ‘It’s Horrific’,https://www.huffpost.com/entry/sean-hannity-trump-george-floyd_n_5ee03a8dc5b66095792b1181
704,0,Defense Secretary Says He 'Didn't Know' He Was Going With Trump To Photo-Op,https://www.huffpost.com/entry/mark-esper-white-house-tear-gas-photo-op_n_5ed6ff28c5b68e90298a5131
705,0,Virginia To Take Down Robert E. Lee Statue,https://www.huffpost.com/entry/virginia-confederate-monument-remove-protests_n_5ed839cac5b6ef445b7631c1
706,0,Brazil’s Disastrous COVID-19 Response Exposes Profound Inequalities,https://www.huffpost.com/entry/brazil-disastrous-covid-19-response-exposes-profound-inequalities_n_5eda2a28c5b6eee284bb8e12
707,0,"Klobuchar Withdraws From VP Search, Says Biden Should Select Woman of Color",https://www.huffpost.com/entry/klobuchar-withdraws-vice-president-search-says-biden-should-select-woman-of-color_n_5eec22f9c5b611f456997669
708,0,"China Delayed Releasing Coronavirus Info, Frustrating WHO: AP Report",https://www.huffpost.com/entry/china-delay-coronavirus-info-frustrate-who-ap-report_n_5ed65befc5b6079a2ccc35cb
709,0,Carole Baskin Awarded Control Of Joe Exotic's Zoo,https://www.huffpost.com/entry/carole-baskin-joe-exotic-zoo-judgment_n_5ed67dbec5b61e005141b105
710,0,Iowa Governor Will Restore Voting Rights To Felons,https://www.huffpost.com/entry/iowa-governor-will-restore-voting-rights-to-formerly-incarcerated-people_n_5eea4b51c5b6b751382e1b20
711,0,Don Lemon Clarifies Why He's 'Calling Out' Major Celebrities,https://www.huffpost.com/entry/don-lemon-calling-out-celebrities_n_5ed647e5c5b6079a2ccc0beb
712,0,Homeland Security Secretary: Trump's Threats To 'Bomb' Bolton Were A Joke,https://www.huffpost.com/entry/chad-wolf-trump-bombing-bolton-book_n_5eef7a35c5b6691f538090f7
713,0,1.5 Million More Americans Sought Unemployment Claims Last Week,https://www.huffpost.com/entry/unemployment-numbers-covid-19_n_5eeb5d6dc5b68d07296ad0a1
714,0,Boy Scouts Of America Will Require Eagle Scouts To Earn New Diversity Badge,https://www.huffpost.com/entry/boy-scouts-diversity-inclusion-badge_n_5eea7da4c5b60a67e3175f06
715,0,"Cuomo Warns He May Reverse Reopenings After New York Gets 25,000 Complaints",https://www.huffpost.com/entry/cuomo-reverse-reopening-new-york_n_5ee6de41c5b64e087259e267
716,0,Anderson Cooper Dismantles Kayleigh McEnany’s ‘Like Churchill’ Defense Of Trump,https://www.huffpost.com/entry/anderson-cooper-kayleigh-mcenany-churchill-trump_n_5ed897c8c5b6513fdffcea76
717,0,Retired General Spots Exact Moment The American Experiment Started To Crumble,https://www.huffpost.com/entry/john-allen-american-experiment-donald-trump_n_5eda02a1c5b678e83f5ddfc7
718,0,Trump Called In The Military To Scare Anti-Racist Protesters. They Showed Up Anyway.,https://www.huffpost.com/entry/george-floyd-protests-continue-despite-trump-threat-military-force_n_5ed711bfc5b68e90298a5c99
719,0,"Thousands In Europe Rally Against Racism, Police Brutality",https://www.huffpost.com/entry/thousands-europe-rally-against-racism-police-brutality_n_5edcf500c5b6ee18dce13c66
720,0,Thomas Jefferson Descendant Calls For Removal Of His Famous Ancestor's Statues,https://www.huffpost.com/entry/thomas-jefferson-shannon-lanier-statues_n_5eed0666c5b6d30db98973e0
721,0,'Disturbing’ Ivanka Trump Emails Resurface In Wake Of Bolton Book,https://www.huffpost.com/entry/walter-shaub-ivanka-trump_n_5eeaceddc5b67b92ff2d260c
