,is_sarcastic,titles,article_link
435,0,George Conway's Group Says 'Coward' Trump Just 'Became What We Always Feared',https://www.huffpost.com/entry/lincoln-project-trump-military_n_5ed84a29c5b6ea15610b2f0e
436,0,DC Mayor Has 'Black Lives Matter' Painted On Street Leading To White House,https://www.huffpost.com/entry/black-lives-matter-street-mural-dc_n_5eda6bc6c5b6be90d977f5f9
437,0,Drew Brees Apologizes For 'Insensitive' Take On NFL Players Kneeling In Protest,https://www.huffpost.com/entry/drew-brees-nfl-players-kneeling-apology_n_5ed9057dc5b6575627583dca
438,0,Children's TV Presenters Go Viral With Heartfelt Messages Addressing Racism,https://www.huffpost.com/entry/bbc-kids-shows-address-racism-viral_n_5ee89435c5b6275acc897980
439,0,Ricky Martin Is Here To Save An Uncertain Summer With New Music,https://www.huffpost.com/entry/ricky-martin-pausa-quarantine-album_n_5ee3f7d3c5b6d5d0fc68f759
440,0,"More Than 1,250 Ex-DOJ Workers Demand Probe Of AG Barr Over Protesters’ Removal",https://www.huffpost.com/entry/doj-alumni-request-barr-probe_n_5ee1103fc5b6d5bafa560466
441,0,Ex-Defense Secretary: ‘Time Has Come’ To Strip Military Bases Of Confederate Names,https://www.huffpost.com/entry/robert-gates-confederate-names-military-bases_n_5ee62902c5b6e73b39d99b7f
442,0,Seth Meyers Issues Blunt Reminder To NYT Over Tom Cotton's ‘Fascist' Op-Ed,https://www.huffpost.com/entry/seth-meyers-new-york-times-tom-cotton-oped_n_5ed9e895c5b678e83f5d8071
443,0,Republicans Prove They Can Focus During A Pandemic... On Confirming Judges,https://www.huffpost.com/entry/justin-walker-mitch-mcconnell-court-seat-affordable-care-act_n_5ed94867c5b6216af71daf66
444,0,Nearly 300 Doctors In Delhi’s Municipal Hospitals Threaten Mass Resignations,https://www.huffpost.com/entry/nearly-300-doctors-in-delhis-municipal-hospitals-threaten-mass-resignations_n_5ee24764c5b6994032026cef
445,0,Trump's Former Defense Secretary Called Him A Threat To The Republic. The GOP Doesn't Care.,https://www.huffpost.com/entry/jim-mattis-trump-letter_n_5ed9289fc5b691340ea24b68
446,0,African Nations Draft Resolution To Investigate U.S. For Human Rights Violations,https://www.huffpost.com/entry/african-nations-draft-resolution-to-investigate-us-for-human-rights-violations_n_5ee89299c5b627d385f5f03c
447,0,Police Arrest Peaceful Protester Sitting Alone By Trump Rally Venue,https://www.huffpost.com/entry/police-arrest-peaceful-protester-sitting-alone-by-trump-rally-venue_n_5eee4722c5b6c875abf8e88b
448,0,Trump's Approval Among White Catholics Has Slipped,https://www.huffpost.com/entry/trump-white-evangelical-catholics-approval-ratings-down_n_5edab0fec5b6b13e7adeb4d9
449,0,Tropical Storm Cristobal Weakens But Flood Threat Persists,https://www.huffpost.com/entry/tropical-storm-cristobal-weakens_n_5edde96fc5b615b2c11a642c
450,0,Trump Threatens Protesters On Juneteenth,https://www.huffpost.com/entry/trump-threatens-protesters-juneteenth_n_5eecc35ec5b672210a267bb5
451,0,Some GOP Heavyweights Won't Vote To Reelect Trump: Report,https://www.huffpost.com/entry/republican-voters-against-trump-wont-vote_n_5edc66acc5b6dcf35913d1e0
452,0,The Fall Of America's Monuments To Racism,https://www.huffpost.com/entry/confederate-monuments_n_5edeaf78c5b637b87e22ce65
453,0,Trump Compared To Segregationist George Wallace In Scathing Republican Ad,https://www.huffpost.com/entry/george-wallace-donald-trump-lincoln-project_n_5eed35e6c5b60982f6f5bdf3
454,0,Susan Rice Explains Exactly Why Trump's White House Is 'Racist To Its Core',https://www.huffpost.com/entry/susan-rice-donald-trump-racist-administration_n_5eedafd9c5b63562b7604a94
455,0,Community Wants Answers After LA Deputies Fatally Shoot Teen Who Ran From Them,https://www.huffpost.com/entry/andres-guardado-shooting-deputies_n_5eee4ee1c5b61ab513465567
456,0,Right-Wing Media’s Antifa Obsession Is Creating A Justification For Harsh Protest Crackdowns,https://www.huffpost.com/entry/protests-antifa-trump-george-floyd_n_5ed56a85c5b66a4da75047cc
457,0,Sunny Hostin Has No Time For Meghan McCain's 'Gone With The Wind' Lament,https://www.huffpost.com/entry/sunny-hostin-meghan-mccain-gone-with-the-wind_n_5ee1096ac5b68bd282e5f6d2
458,0,WaPost Board: Pence Destroys Own Credibility By Ignoring Coronavirus Reality,https://www.huffpost.com/entry/washington-post-editorial-board-mike-pence-coronavirus_n_5eeb0dbbc5b6eab8ed9c5851
459,0,A '30 Rock' Reunion Is Sort Of Happening And We Want To Go To There,https://www.huffpost.com/entry/30-rock-reunion-is-sort-of-happening-and-we-want-to-go-to-there_n_5ee9259ec5b6273a4c50e17b
460,0,"For Black Women, There's Nothing To Celebrate In The Unemployment Numbers",https://www.huffpost.com/entry/for-black-women-nothing-to-celebrate-in-the-unemployment-numbers_n_5eda74bac5b67439db06dd05
461,0,Late Show Hosts Expose The Big Problem With John Bolton’s Tell-All Trump Book,https://www.huffpost.com/entry/john-bolton-book-donald-trump-late-show-hosts_n_5eeb1ac7c5b6f7ce6ac34b58
462,0,Ingraham Shows She’s Either Oblivious To Trump's Racism — Or Is Gaslighting You,https://www.huffpost.com/entry/laura-ingraham-donald-trump-defense-racist_n_5ee9b5f3c5b6b62edbe4271a
463,0,I Don’t Need A Self-Isolation Project. I Need Time To Grieve.,https://www.huffpost.com/entry/productivity-coronavirus-quarantine-grieving_n_5e958adfc5b606109f5fd6f8
464,0,Prosecutor Says No Charges In Deadly Shooting Of Omaha Protester James Scurlock,https://www.huffpost.com/entry/protester-james-scurlock-killed-no-charges_n_5ed57067c5b680613a2bd6ca
465,0,"If We Want To Stop Police Brutality, Here Are The Immediate Steps Our Leaders Must Take",https://www.huffpost.com/entry/government-leaders-end-police-brutality-immediate-steps-to-take_n_5ed97588c5b69d703f3860c5
466,0,Adele Fights Back Tears Honoring Victims Of Grenfell Tower Fire 3 Years Later,https://www.huffpost.com/entry/adele-fights-back-tears-honoring-victims-of-grenfell-tower-fire-3-years-later_n_5ee8bd70c5b6881c9291090b
467,0,LAPD Accused Of Shooting Man In Wheelchair In The Face With Rubber Bullets,https://www.huffpost.com/entry/lapd-man-shot-in-face_n_5edbeea1c5b691d5e0157182
468,0,My Family Had To Do Social Distancing For 5 Weeks In 2014. Here's What We Learned.,https://www.huffpost.com/entry/social-distancing-prepare-coronavirus_n_5e6fb6f1c5b6eab7793a1320
469,0,Twitter Users Touched By Herman Munster's Speech Of Tolerance And Humanity,https://www.huffpost.com/entry/herman-munster-tolerance-speech_n_5ed969e3c5b69d703f38544c
470,0,"Trump Camp Lashes Media, 'Radical Protesters' For Lackluster Rally Turnout",https://www.huffpost.com/entry/trump-tulsa-protesters-media-crowd_n_5eee9c67c5b622c96e213845
471,0,Mississippi Official: Black People 'Dependent' Since Slavery,https://www.huffpost.com/entry/lowndes-county-harry-sanders-confederate-monument_n_5eea11e1c5b69465b1630aa0
472,0,Justin Bieber: 'I Have Benefited Off Of Black Culture',https://www.huffpost.com/entry/justin-bieber-black-lives-matter-post_n_5ede43fac5b646977338a96a
473,0,How COVID-19 Is Driving Sex Workers Like Me Into Crisis,https://www.huffpost.com/entry/sex-workers-covid-19-coronavirus_n_5e6f653ac5b6bd8156fbbdc5
474,0,Minneapolis Mayor Booed After Saying He Wouldn't 'Abolish' Police Department,https://www.huffpost.com/entry/minneapolis-mayor-jacob-frey-booed-abolish-police_n_5edc5396c5b64fc8dcbd87ce
475,0,'A Setup For Disaster': Doctors Issue Ominous Coronavirus Warnings About Trump Rally,https://www.huffpost.com/entry/donald-trump-rally-tulsa-warning-doctors_n_5ee48d4cc5b6e78477a27d7b
476,0,Jay-Z Pleads For Justice For George Floyd: 'Look At Yourselves',https://www.huffpost.com/entry/jay-z-george-floyd-minnesota_n_5ed52217c5b6a2704f44bef6
477,0,"Interior Dept. Consulted ‘Junk Science’ Troll On ‘Transparency’ Rule, Emails Show",https://www.huffpost.com/entry/steve-milloy-junk-science-interior-department_n_5eebbe63c5b6fb7ffc86626d
478,0,Tucker Carlson Rails Against Elmo And His Dad In Bonkers New Rant,https://www.huffpost.com/entry/tucker-carlson-elmo-sesame-street_n_5ee05f16c5b61417f817d4d2
479,0,We're Medical Students Ready To Fight The Coronavirus. Here Is What's Holding Us Back.,https://www.huffpost.com/entry/medical-students-graduate-early-coronavirus_n_5e91cd90c5b6f7b1ea822149
480,0,The Tentative Return of Summer Fun Has Begun In Europe,https://www.huffpost.com/entry/europe-spain-travel-tourism-beach-vacation_n_5eeb3863c5b68d07296a82b0
481,0,Obama Photographer Takes Not-So-Subtle Swipe At Donald Trump's Bible Stunt,https://www.huffpost.com/entry/pete-souza-barack-obama-church-donald-trump_n_5ed8e0cdc5b6110838fa077e
482,0,Trump Shares Letter Saying White House Protesters Are 'Terrorists',https://www.huffpost.com/entry/donald-trump-protesters-terrorists_n_5ed9c2e9c5b612748cc65a00
483,0,Music Industry Declares June 2 As 'Black Out Tuesday' Amid Unrest,https://www.huffpost.com/entry/black-out-tuesday_n_5ed5898ec5b6449ef9663e76
484,0,Martin Luther King Jr.'s Daughter Says People Are Twisting His Riot Quote,https://www.huffpost.com/entry/martin-luther-king-daughter-riot-quote_n_5eda3c80c5b6764e1a452d1e
485,0,House Judiciary Chairman: Calls For Barr's Impeachment Are 'Waste Of Time',https://www.huffpost.com/entry/jerry-nadler-william-barr-impeachment_n_5eef6e00c5b662a7cb35a3eb
486,0,Evangelical Leader Calls On Denomination To Retire Gavel Named For Slaveholder,https://www.huffpost.com/entry/broadus-gavel-southern-baptist-jd-greear_n_5ee261fdc5b6fdbc0a8e5448
487,0,Welcome To The Mask Wars,https://www.huffpost.com/entry/mask-coronavirus-cities-counties_n_5eea9138c5b693425b94a990
488,0,Trump Takes Credit For 'Making Juneteenth Famous' In Dumbfounding Interview,https://www.huffpost.com/entry/trump-takes-credit-juneteenth-famous_n_5eeb8b82c5b6e65c95eab4b7
489,0,"As A Grocery Store Worker, I'm On The Frontline Of Coronavirus And I'm Overwhelmed",https://www.huffpost.com/entry/grocery-store-employee-covid-19_n_5e78c99ac5b6f5b7c54839ae
490,0,White House Doubles Down On Trump’s Smear Against Protester Shoved By Police,https://www.huffpost.com/entry/white-house-defends-trump-protester-antifa-tweet_n_5ee10003c5b6ec1204af6886
491,0,I'm One Of The Resident Doctors In NYC. Here's How We're Being Exploited.,https://www.huffpost.com/entry/resident-doctor-coronavirus-exploitation_n_5eb1a9d3c5b6a15b6f471eaa
492,0,Atlanta Police Officers Call Out Of Work After Officers Charged In Rayshard Brooks Case,https://www.huffpost.com/entry/atlanta-officers-call-out-rayshard-brooks_n_5eeb4faac5b68d07296aadbf
493,0,Randy Rainbow Bashes 'Bunker Boy' Donald Trump In New Song Parody,https://www.huffpost.com/entry/randy-rainbow-bunker-boy-donald-trump_n_5ede1769c5b666e2e2f7e71b
494,0,John Oliver Mocks Saddest Thing About Trump's Tulsa Rally Attendance,https://www.huffpost.com/entry/john-oliver-trump-tulsa-rally_n_5ef0a3f9c5b627efb396988a
495,0,Jimmy Kimmel Taunts Donald Trump Jr. With New Nickname,https://www.huffpost.com/entry/jimmy-kimmel-donald-trump-jr-new-nickname_n_5ee207fdc5b6301f6320b139
496,0,Rush Limbaugh Tells Breakfast Club: 'I Don't Feel Like I'm A White Supremacist',https://www.huffpost.com/entry/rush-limbaugh-breakfast-club-interview_n_5ed55394c5b600d92da905b2
497,0,Republican Group Questions Trump’s Health: ‘It’s Time We Talk About This’,https://www.huffpost.com/entry/lincoln-project-trump-health_n_5ee97a21c5b695286b78a2e7
498,0,I'm A Black Woman With A White Man. These Weeks Have Been The Hardest Of Our Relationship.,https://www.huffpost.com/entry/black-woman-white-man-relationship_n_5ee25af1c5b664f94c4e1889
499,0,Kumail Nanjiani Delivers Perfect Line At 'Ghostbusters' Zoom Reunion,https://www.huffpost.com/entry/ghostbusters-reunion-zoom_n_5ee8bedac5b66436181897ec
500,0,"Inmate In Brooklyn's Federal Jail Dies After Being Pepper-Sprayed, Removed From Cell",https://www.huffpost.com/entry/jamel-floyd-mdc-brooklyn-dies_n_5ed8da05c5b60050eb286502
501,0,Tucker Carlson’s Racist Rhetoric Laid Bare With The Help Of Some... Rabbits,https://www.huffpost.com/entry/tucker-carlson-rabbits-racism-black-lives-matter_n_5eeb36e9c5b68d07296a805e
502,0,Judge Rejects White House Request To Block John Bolton's New Book,https://www.huffpost.com/entry/judge-rejects-white-house-demand-to-block-john-boltons-new-book_n_5eee208bc5b643bd520bb855
503,0,Fauci Warns Of Troubling ‘Anti-Science’ Beliefs As Nation Battles Coronavirus,https://www.huffpost.com/entry/anthony-fauci-anti-science-coronavirus_n_5eec2e7ec5b6f2720db35fe1
504,0,"Trump Takes Vindictive Swipe At GOP Senator Opposing Him, Endorses Anyone ‘Good Or Bad’",https://www.huffpost.com/entry/donald-trump-pulse-candidate-tweet_n_5eda1131c5b68843ed301908
505,0,Trump Poses With Bible After Having Protesters Cleared Away With Tear Gas,https://www.huffpost.com/entry/donald-trump-bible-tear-gas-protesters_n_5ed58beac5b6449ef9663fa1
506,0,"Donald Trump Jr.'s Mongolia Hunting Trip Cost Taxpayers $77,000",https://www.huffpost.com/entry/donald-trump-jr-mongolia-hunting-trip-endangered-sheep_n_5edf126bc5b6948cbc5c971a
507,0,Yosemite National Park To Reopen This Week,https://www.huffpost.com/entry/yosemite-national-park-reopening-coronavirus_n_5edfc1ebc5b6d4bfcd57ed6a
508,0,NASCAR Driver Ray Ciccarelli Says He'll Quit After Confederate Flag Ban,https://www.huffpost.com/entry/ray-ciccarelli-nascar-confederate-flag_n_5ee22a96c5b6625b095ba31d
509,0,Gwyneth Paltrow Reveals What The Follow-Up To Her 'Vagina' Candle Smells Like,https://www.huffpost.com/entry/gwyneth-paltrow-new-orgasm-candle-jimmy-fallon_n_5eea01d6c5b632dbe0e1d5d1
510,0,Anderson Cooper Blasts 'Lie Teller' Kayleigh McEnany For 'Orwellian' Trump Defense,https://www.huffpost.com/entry/anderson-cooper-kayleigh-mcenany_n_5ee1945ac5b65a7f2d98a730
511,0,Don Lemon: Trump Just Said ‘The Dumbest Thing I’ve Ever Heard’,https://www.huffpost.com/entry/don-lemon-donald-trump-dumbest-thing-ever_n_5ee3273cc5b6cea9276dc08e
512,0,Dwyane Wade's Daughter Zaya Embodies Medieval Pride As She Turns 13,https://www.huffpost.com/entry/dwyane-wade-daughter-zaya-medieval-13-birthday-party_n_5ee77cadc5b6c2be9cb915f3
513,0,COVID-19 Live Updates: Young Chicago Patient Receives Lung Transplant,https://www.huffpost.com/entry/covid-19-updates-patients-health-us-world_n_5ee37bc7c5b68e7cd8592084
514,0,New Mexico Shooting Raises Specter Of Right-Wing Violence Around Statue Protests,https://www.huffpost.com/entry/new-mexico-shooting-right-wing-violence-statue-protests_n_5ee96e88c5b6f54b3eac21ca
515,0,Kelly Clarkson Slays Chill-Inducing Cover Of 'Chain Of Fools' After Divorce News,https://www.huffpost.com/entry/kelly-clarkson-slays-chill-inducing-cover-of-chain-of-fools-after-divorce-news_n_5ee8d28ac5b67c0f6dbd970c
516,0,How Hollywood Has Shaped Our Understanding Of Police,https://www.huffpost.com/entry/todd-boyd-hollywood-shaped-understanding-police_n_5ee152cec5b6f76404de56e3
517,0,Partisan Fault Lines Emerge In Congress Over Police Reform,https://www.huffpost.com/entry/police-reform-george-floyd-congress_n_5ee38270c5b610a4ed7096a9
518,0,Trump Excoriates John Bolton Ahead Of Book Release: 'He Is A Liar',https://www.huffpost.com/entry/trump-john-bolton-book-liar-response_n_5eea9795c5b6d63d2965b1d2
519,0,Twitter Adds 'Manipulated Media' Tag To Trump Tweet About 'Racist Baby',https://www.huffpost.com/entry/twitter-trump-baby-tweet_n_5eec619bc5b6f2720db38d2b
520,0,Nancy Pelosi Removes Portraits Of Confederate House Speakers From U.S. Capitol,https://www.huffpost.com/entry/nancy-pelosi-confederate-portraits-us-capitol-building_n_5eeb706ec5b68d07296b0420
521,0,Former U.S. Ambassador Jean Kennedy Smith Dies At 92,https://www.huffpost.com/entry/jean-kennedy-smith-jfk-sister-dead-92_n_5eeb9bbcc5b66743723436a5
522,0,"My Family Is Trapped In Paradise During The Coronavirus, But It's No Vacation",https://www.huffpost.com/entry/coronavirus-stranded-abroad-family_n_5e7cb9efc5b6cb08a92923d4
523,0,9-Year-Old 'Magic: The Gathering' Player Champions Age And Gender Diversity,https://www.huffpost.com/entry/magic-the-gathering-dana-fischer_n_5ee9114dc5b6273a4c50b9fd
524,0,Trump Sets The Stage For Mayhem At Tulsa Rally,https://www.huffpost.com/entry/trump-tulsa-rally-fears-of-violence_n_5eed0d3bc5b6d30db9898280
525,0,Protesters Topple Confederate Statue In Virginia Capital,https://www.huffpost.com/entry/confederate-williams-carter-wickham-statue-toppled_n_5edce8fac5b69145c2923071
526,0,I Studied The 2014 Ebola Outbreak. Here's The Lesson We Didn't Learn.,https://www.huffpost.com/entry/covid-19-response-lessons-from-ebola_n_5ea85d68c5b6f62665e395c8
527,0,I'm A Real Tiger Keeper. Here's What Disturbed Me About 'Tiger King.',https://www.huffpost.com/entry/tiger-king-coronavirus-zoo-keeper-joe-exotic_n_5e8f49b3c5b6d641a6bb8001
528,0,Popular Bollywood Actor Sushant Singh Rajput Dies At 34,https://www.huffpost.com/entry/sushant-singh-rajput-dies_n_5ee67addc5b6efec77586903
529,0,Police: Cellphone Pings Helped Locate Missing Idaho Children's Remains,https://www.huffpost.com/entry/vallow-children-bodies-found-using-phone-data_n_5eef9f18c5b62f738cf9a2a2
530,0,Bryce Dallas Howard Wants White People To 'Go Further' Than Watching 'The Help',https://www.huffpost.com/entry/bryce-dallas-howard-wants-white-people-to-go-further-than-watching-the-help_n_5ede8af6c5b6ee33e17782f9
531,0,'Who's The Thug Here?': Anderson Cooper Unleashes On Donald Trump,https://www.huffpost.com/entry/anderson-cooper-cnn-trump-protests-washington_n_5ed5b371c5b6480deb60e330
532,0,Tucker Carlson Stuns Twitter Users With 'Most Racist' Thing He's Ever Said,https://www.huffpost.com/entry/tucker-carlson-coming-for-you_n_5edf056ac5b6948cbc5c8d0f
533,0,Just Because I'm 90 Doesn't Mean I'm Ready To Die ― Or Disposable,https://www.huffpost.com/entry/i-am-old-not-disposable-coronavirus-pandemic_n_5ea7295dc5b6a30004e67306
534,0,The Fight To Fix Policing Starts At The City Council,https://www.huffpost.com/entry/janeese-lewis-george-districi-of-columbia-police-reform-city-councils_n_5edaab12c5b6dc3de7b95082
535,0,Charles Booker Suddenly Has Progressives Excited About Kentucky,https://www.huffpost.com/entry/charles-booker-amy-mcgrath-kentucky-senate-primary_n_5eeba020c5b6674372343f33
536,0,Donald Trump Vows To Keep Trying To End Dreamer Protections,https://www.huffpost.com/entry/trump-vows-to-end-daca_n_5eeccc3fc5b672210a268edc
537,0,Drink In James Corden's Mini Montage Of Trump Weirdly Drinking Water,https://www.huffpost.com/entry/donald-trump-drinking-water-corden_n_5ee8b5d8c5b6f858da9c0614
538,0,Tulsa Health Official Urges Rally Postponement As Oklahoma Sees Spike In COVID-19 Cases,https://www.huffpost.com/entry/trump-tulsa-rally-coronaviru_n_5eea468ec5b63c93567e89c9
539,0,Twitter Users Spot The Utter Hypocrisy Of Trump’s Past Advice About Protests,https://www.huffpost.com/entry/donald-trump-tweets-meeting-protesters_n_5ed602bcc5b69bcd97d632de
540,0,SHOCK: White Supremacist Congressman Steve King Defeated In GOP Primary,https://www.huffpost.com/entry/steve-king-loses-primary-republican_n_5ed6e9fbc5b6aade1be3944a
541,0,Jimmy Kimmel Thinks Trump's Bunker Excuse Is A Bunch Of Bunk,https://www.huffpost.com/entry/jimmy-kimmel-thinks-trumps-bunker-excuse-is-a-bunch-of-bunk_n_5ed8ecf8c5b6d56106617ad9
542,0,Legendary Batman Writer And DC Comics Editor Denny O'Neil Dies,https://www.huffpost.com/entry/batman-dc-comics-denny-oneil_n_5ee3e18dc5b699cea53189a6
543,0,Coronavirus Live Updates: Read The Latest About The COVID-19 Outbreak,https://www.huffpost.com/entry/covid-19-latest-global-news_n_5ede3c65c5b666e2e2f84d17
544,0,White House Forces Press To Breach Social Distancing Guidelines Because It 'Looks Better',https://www.huffpost.com/entry/white-house-press-chairs-social-distancing-coronavirus_n_5edabab6c5b685414767a768
545,0,The Black Lives Matter Protests Are Working. Here’s Proof.,https://www.huffpost.com/entry/black-lives-matter-protests-change_n_5ee28ed5c5b64c615ed303d1
546,0,America Forced Me To Have 'The Talk' With My Black Child Before I Was Ready,https://www.huffpost.com/entry/the-talk-parents-of-black-kids_n_5ee0039dc5b6716df298adaa
547,0,The Police Aren't Very Good At Their Main Job: Solving Crimes,https://www.huffpost.com/entry/the-police-arent-good-at-solving-crimes_n_5ee7b4fbc5b614b68adec9b1
548,0,Trump Administration Proposes Sweeping Asylum Restrictions,https://www.huffpost.com/entry/trump-asylum-limits_n_5ee24125c5b69fb03b5c1d3e
549,0,Spike Lee Says Trump Should Not Talk About George Floyd,https://www.huffpost.com/entry/spike-lee-says-trump-shouldnt-talk-about-george-floyd_n_5edfa1c4c5b66e4c3312eab9
550,0,"Pressed Repeatedly To Say ‘Black Lives Matter,’ Mike Pence Says ‘All Lives Matter’",https://www.huffpost.com/entry/mike-pence-black-lives-matter-all-lives-matter-interview_n_5eed556bc5b6c86872f8be62
551,0,"Kanye West Protests In Chicago, Donates To Families Of Breonna Taylor, George Floyd",https://www.huffpost.com/entry/kanye-west-breonna-taylor-george-floyd_n_5eda67efc5b6ff96049fb087
552,0,Millions Of Hydroxychloroquine Pills That Trump Touted For COVID-19 Are Now In Limbo,https://www.huffpost.com/entry/malaria-pill-surplus-trump-covid-19_n_5eea1968c5b6e63de82cd94c
553,0,Ilhan Omar Isn't Done Fighting,https://www.huffpost.com/entry/ilhan-omar-isnt-done-fighting_n_5ee91c91c5b6b6d8fb99c921
554,0,"Jerry Falwell Jr. Apologizes For Blackface ‘Joke’ After Staff, Alumni Revolt",https://www.huffpost.com/entry/jerry-falwell-jr-blackface-apology_n_5edf399cc5b6c38e0d816e4b
555,0,The Coronavirus Pandemic Doesn't Care That We're All Bored With It,https://www.huffpost.com/entry/the-coronavirus-doesnt-care-that-were-bored_n_5eebbc0dc5b6d9234ce7b1b7
556,0,Wisconsin Gym Under Fire For 'I Can't Breathe' Workout,https://www.huffpost.com/entry/wisconsin-gym-i-cant-breathe-workout-george-floyd_n_5ee166fec5b628e440314886
557,0,"Colbie Caillat Is Still 'Bubbly,' But Now A Little Bit Country, Too",https://www.huffpost.com/entry/colbie-caillat-gone-west-album_n_5ede7f0dc5b64e95577d00f8
558,0,Buffalo Mayor Says Police Union Is 'On The Wrong Side Of History',https://www.huffpost.com/entry/buffalo-mayor-police-union-protests_n_5edb06d0c5b67f2275c1ccee
559,0,Twitter Users Take Eric Trump To The Woodshed For Lame Swipe At Biden,https://www.huffpost.com/entry/eric-trump-joe-biden-tweet-backfires_n_5eec6612c5b63025c67105d4
560,0,Biden Formally Secures Democratic Presidential Nomination,https://www.huffpost.com/entry/biden-clinched-democratic-nomination_n_5edb04dfc5b67f2275c1cc14
561,0,Inside The Dangerous Online Fever Swamps Of American Police,https://www.huffpost.com/entry/police-protests-floyd-law-enforcement-today-rant_n_5ee3ef5fc5b699cea53196b4
562,0,Black Lives Matter Protesters Tear Down Slave Trader Statue In UK And Dump In Harbor,https://www.huffpost.com/entry/black-lives-matter-protesters-tear-down-slave-trader-statue-in-bristol_n_5edd0adec5b6442ed046ab63
563,0,Tennessee Newspaper Blasted For Printing Ad Claiming 'Islam' Is Going To Nuke Nashville,https://www.huffpost.com/entry/the-tennessean-islamophobic-ad_n_5eef957ec5b615bc9414b0d7
564,0,Progressive Charles Booker Unveils First Big Ad Buy In Race To Oust Mitch McConnell,https://www.huffpost.com/entry/charles-booker-amy-mcgrath-mitch-mcconnell_n_5edeb10cc5b6e7211b7fb5a1
565,0,Ex-Defense Secretary: White House ‘Leading Us Down The Trail Toward A Dictatorship',https://www.huffpost.com/entry/william-cohen-donald-trump-dictatorship_n_5edb4594c5b6da5b9890ea57
566,0,EPA Said Giving Polluters A Pass Protected Its Workers. Its Own Union Says That’s Gaslighting.,https://www.huffpost.com/entry/epa-coronavirus_n_5ee2311ec5b609eb15f14679
567,0,Obama Says We Should Learn 'Impatience' From Young Protesters,https://www.huffpost.com/entry/obama-protesters-george-floyd-racism_n_5edacab6c5b685414767cc72
568,0,"Lockdown A Week Earlier Would Have Halved UK Coronavirus Death Toll, Says Neil Ferguson",https://www.huffpost.com/entry/lockdown-a-week-earlier-would-have-halved-uk-coronavirus-death-toll-says-neil-ferguson_n_5ee247f3c5b689339c2737ad
569,0,"North Korea Vows To Build Up Military, Blasting 'Empty Promises' Made By Trump",https://www.huffpost.com/entry/north-korea-military-trump_n_5ee31be0c5b67fa8b89247d6
570,0,"After 7 1/2 Months Sober, I Relapsed During Quarantine. Here's What Happened.",https://www.huffpost.com/entry/relapse-addiction-covid-19-pandemic_n_5ec2df95c5b684c3d6072376
571,0,Protest Records Show Scant Evidence Of Trump's Bogus Antifa Claims,https://www.huffpost.com/entry/trump-antifa-scant-evidence_n_5edc4cacc5b6dcf35913c15b
572,0,‘We’re Here To Stay’: Dreamers Celebrate DACA Ruling,https://www.huffpost.com/entry/dreamers-celebrate-daca-ruling_n_5eebd305c5b6a6a9a32f4645
573,0,"Democrats Knock GOP Police Reform Bill, Call For 'Improvement'",https://www.huffpost.com/entry/police-reform-congress-democrats-gop_n_5eea2b64c5b6ac8384ad7c77
574,0,'We'll Meet Again' Singer Who Raised British Spirits During WW2 Dies,https://www.huffpost.com/entry/dame-vera-lynn-dead-ww2-singer_n_5eeb40d1c5b61a3b81c5e82e
575,0,Democrats Say Law Protecting LGBTQ Rights Still Needed Even After SCOTUS Victory,https://www.huffpost.com/entry/lgbtq-supreme-court-ruling-merkley-equality-act_n_5ee7c734c5b655d06c1e6b95
576,0,I’m A Tarot Card Reader. Here’s What People Want Most From Me During The Pandemic.,https://www.huffpost.com/entry/tarot-cards-reading-meaning-covid-19_n_5ebd5a55c5b6db31b5f9ad36
577,0,"At 34, I Won’t Be Fertile Forever. Should I Get Pregnant Amid The Coronavirus Crisis?",https://www.huffpost.com/entry/trying-to-get-pregnant-during-coronavirus_n_5e7e188dc5b6614922663364
578,0,California Police Investigating Nooses Found In Trees As A Hate Crime,https://www.huffpost.com/entry/oakland-california-lake-merritt-nooses_n_5eea69a6c5b6d4397ade4ea2
579,0,Jon Stewart Eviscerates The 'Worst Legacy' Of 'The Daily Show',https://www.huffpost.com/entry/jon-stewart-the-daily-show-eviscerating_n_5ee7c402c5b683f461510c7d
580,0,I’m A Parent Making Porn To Make Ends Meet During Covid Quarantine,https://www.huffpost.com/entry/porn-making-covid-19_n_5ea0731dc5b69150246c4ba3
